sku_id,_id,item_name,comment_id,content,creation_time,reply_count,score,useful_vote_count,useless_vote_count,user_level_id,user_province,nickname,user_level_name,user_client,user_client_show,is_mobile,days,reference_time,after_days,after_user_comment
5942439,a9114635-9d7a-436d-9f83-e175b9e8c2f7,comment,11798034456,第三次购买了，质量不错，很耐用，老人用最好了！！！给个赞！！！,"2018-08-12 10:19:26",0,5,0,0,62,,j***l,金牌会员,2,来自京东iPhone客户端,1,1,"2018-08-11 13:18:42",0,NO_MESSAGE
7479912,bc633b6f-eda7-4023-89c1-c9dc556de724,comment,11750715360,我跟你说呀，这个东西极好，吃鸡党有福了，全特效吃鸡画质爆棚而且一点都不卡，开高倍镜找人一找一个准，发烫不是很烫，你专注打游戏是感觉不到烫的，不存在烫手一说。,"2018-07-28 17:22:42",0,5,2,0,61,,j***5,银牌会员,4,来自京东Android客户端,1,4,"2018-07-24 18:45:07",0,NO_MESSAGE
29638202857,58bcf93e-97f7-46de-94e9-9fb837d37f67,comment,11692071514,很漂亮的电话，支持京东，支持国产,"2018-07-11 04:00:00",0,5,0,0,105,,凯***y,PLUS会员,2,来自京东iPhone客户端,1,3,"2018-07-08 02:31:13",0,NO_MESSAGE
22863264117,45fccdce-7e26-4815-852e-37ef34400379,comment,11383176749,运行还行，没有送礼品，现在用的还可以，后面就不知道啦！,"2018-04-09 15:43:55",1,5,0,0,62,,简***8,金牌会员,4,来自京东Android客户端,1,40,"2018-02-28 22:38:38",0,NO_MESSAGE
7534113,e9986b17-0f97-4c84-89eb-9fcd774c76e2,comment,11799229874,一次买了两部给孩子们用，手机很漂亮，孩子们很喜欢,"2018-08-12 16:21:06",0,5,0,0,61,,j***0,银牌会员,4,来自京东Android客户端,1,2,"2018-08-10 17:10:36",0,NO_MESSAGE
5920651,07f1aea5-6645-42ba-8a52-3f4389fb2ca7,comment,11293455991,手机不错，性价比高，质量不错,"2018-03-09 08:38:30",0,5,0,0,105,,x***8,PLUS会员,2,来自京东iPhone客户端,1,3,"2018-03-06 07:00:09",0,NO_MESSAGE
12764636413,3e01f94e-9343-49d2-b897-f87bdfdce8f7,comment,11771091547,妈妈说用着还可以，但是她有点嫌弃屏小,"2018-08-03 22:37:16",0,5,0,0,61,,j***j,银牌会员,4,来自京东Android客户端,1,2,"2018-08-01 10:40:40",0,NO_MESSAGE
5402840,b3fe6b49-2f5f-476e-bdf4-db6cb5cb3fab,comment,11767226916,买给妈妈的，年纪大了，这个键盘大，声音响。,"2018-08-02 18:55:16",0,5,0,0,62,,z***5,PLUS会员,4,来自京东Android客户端,1,26,"2018-07-07 22:08:50",0,NO_MESSAGE
28082716822,7cd6ece4-2585-41e9-af94-63cbd740dcc8,comment,11587194169,东西不错，包装结实完美，物流也很快，一次愉快的购物,"2018-06-13 10:52:50",0,5,2,0,105,,h***c,PLUS会员,4,来自京东Android客户端,1,12,"2018-06-01 18:15:01",0,NO_MESSAGE
7437788,fdab1689-e610-4769-be60-dde8fbbd6434,comment,11666955931,6.18抢到的，29号收到，时间漫长。指纹印很明显；送的软壳套着，不能和镜头持平，有一点点低，放手机的时候很怕刮到镜头；128G有119G可用，对于目前是够用了；隐藏刘海其实没什么意义，有些软件在看视频的时候，等于是直接盖住了一部分；游戏操作流畅；人脸识别也快；总的来说还是满意的。,"2018-07-03 11:43:42",2,5,36,0,105,,jd36974489,PLUS会员,2,来自京东iPhone客户端,1,15,"2018-06-18 21:25:52",19,用了一段时间，有时会出现闪退，卡顿，人脸识别有时候反应有点慢，还有带着眼镜有时竟然识别不了。。。音量确实不大，小，耳机听歌声音小。。。耗电量大。。。感觉满满的缺点。。。
25774787882,5bf450f8-c025-489b-9077-5e262eb3b530,comment,11771708298,"oppo R15，这款手机非常的好用，屏幕也大，特别是照相功能杠杠的，用着感觉非常的好，这是给老婆买的手机，老婆非常的高兴，嗯，京东的品质有保障","2018-08-04 09:12:28",1,5,0,0,62,,王***利,金牌会员,4,来自京东Android客户端,1,23,"2018-07-12 13:48:11",0,NO_MESSAGE
8484451,cc8b4675-9949-4a85-88b6-14b7648e6f4d,comment,11769955974,这个外观确实挺漂亮的。这个价位算是做到最好看的了吧。,"2018-08-03 16:06:42",1,5,0,0,62,,j***妹,PLUS会员,2,来自京东iPhone客户端,1,1,"2018-08-02 11:06:08",0,NO_MESSAGE
7694047,73c320b1-fa5c-4c7d-ae44-d91afa5fe154,comment,11802231702,手机还好，京东客服人员也很有耐心，手机运行速度快，可能天气太热了、手机用起来没多久就有点发烫,"2018-08-13 14:49:02",0,5,0,0,56,,j***g,铜牌会员,2,来自京东iPhone客户端,1,1,"2018-08-12 01:29:51",0,NO_MESSAGE
7846413,efcecb1b-a608-4189-9d36-1305b047108b,comment,11671117616,送货很快，当天买了当天就到了，快递也是非常好的，希望京东可以一直保持下去。送货很快，当天买了当天就到了，快递也是非常好的，希望京东可以一直保持下去。送货很快，当天买了当天就到了，快递也是非常好的，希望京东可以一直保持下去。,"2018-07-04 15:56:08",0,5,0,0,105,,乐***C,PLUS会员,0,,0,33,"2018-06-01 00:05:16",0,NO_MESSAGE
11107032701,b7f467cb-a582-405a-9cd6-886f2fdb2551,comment,11520803553,感觉不错，用段时间再来评论！,"2018-05-26 10:26:08",0,5,0,0,105,,l***h,钻石会员,4,来自京东Android客户端,1,2,"2018-05-24 15:35:48",0,NO_MESSAGE
8239683,60f75602-802e-4b0d-83a6-648a966b8f8b,comment,11742948915,还可以，反应速度还挺快的。,"2018-07-26 10:39:44",0,5,3,0,56,,天***那,铜牌会员,4,来自京东Android客户端,1,1,"2018-07-25 10:25:14",0,NO_MESSAGE
25834204287,2975d551-b065-4532-91a8-d8cf7fb1fc50,comment,11474300113,手机已经使用三天了，到目前为止没有任何问题，触屏也很流畅，运行速度也蛮快，还是苹果的通病点池不经用。还有物流稍微慢了点。,"2018-05-11 13:02:11",1,5,1,0,61,,K***2,银牌会员,21,来自微信购物,0,6,"2018-05-05 13:44:08",0,NO_MESSAGE
5853593,81e9ce53-1aa3-4c2e-96ec-43a27063df45,comment,11783486456,我是个犹豫型，有选择困难症的人，一般买东西都在网上买，对比所有产品一轮后，再看评论，看细节，慢慢锁定要的几个品牌再慢慢筛选，我一直用苹果手机，帮老人买部安卓版的手机，刚开始看了oppo，拍了以后慢慢对比华为荣耀，觉得好太多了，又退了oppo，从运行外观销量和用户评论来看，荣耀当之不愧国产目前最好的选择，门面的客服服务和京东客服都非常有耐心，京东的快递员要特别的表扬一下，送货速度和态度服务永远比其他快递员快，好。一开始用过京东，一直用京东,"2018-08-07 19:25:14",1,5,0,0,62,,j***p,金牌会员,2,来自京东iPhone客户端,1,0,"2018-08-07 09:02:47",0,NO_MESSAGE
15612619462,269319e3-9a7d-443e-8841-e55aa1231e4f,comment,11800254037,买给老爸的，很不错，性价比也是极高的！,"2018-08-12 21:58:08",1,5,0,0,62,,定***锵,金牌会员,4,来自京东Android客户端,1,17,"2018-07-26 10:36:01",0,NO_MESSAGE
13521715420,d7b3d28e-5196-4bb7-a835-fe9209b2774b,comment,11627904944,给妈妈买的，用着还不错～～～～～给妈妈买的，用着还可以～～～～～～,"2018-06-22 13:25:52",0,5,0,0,62,,j***n,金牌会员,4,来自京东Android客户端,1,41,"2018-05-12 16:08:12",0,NO_MESSAGE
7321794,8c3c35c3-5f98-4117-8785-21951af777c6,comment,11572486680,外观不错，性能够用，就是偏贵，同样小米8便宜1000，配置比20还要好，外观是20最大的卖点了！,"2018-06-09 14:26:12",0,5,1,0,62,,丁***杨,PLUS会员,4,来自京东Android客户端,1,1,"2018-06-08 13:07:38",0,NO_MESSAGE
1592994,d17b2a35-ac9b-418a-84e8-33352712b1a9,comment,11747721152,衣服辞工炒股u刚才要邮费衣服粗发粗发粗发粗粗他,"2018-07-27 17:52:14",0,5,0,0,105,,唯***買,PLUS会员,4,来自京东Android客户端,1,4,"2018-07-23 12:41:36",0,NO_MESSAGE
7437768,fd4750de-4a13-4ea2-90b7-764828a5aa40,comment,11798140079,好用不贵，经济实惠，京东的配送速度也是没的说的！,"2018-08-12 10:44:20",0,5,0,0,105,,蒙***_,PLUS会员,4,来自京东Android客户端,1,6,"2018-08-06 18:59:12",0,NO_MESSAGE
8344046,b6b0029b-a235-4702-a7c7-95f32e06434d,comment,11798818201,手机将就能用,"2018-08-12 14:07:51",1,3,0,0,61,,j***c,银牌会员,4,来自京东Android客户端,1,3,"2018-08-09 14:56:23",0,NO_MESSAGE
5089275,e43d3a98-a1f1-4f31-9571-b67cf9618d2f,comment,10922280189,开始选择性障碍。在泰国清迈为老岳母选台iPhone，希望她能喜欢，祝老岳母生日快乐。谢谢京东提供的产品和服务，在京东第四台苹果电话，IT都选择京东。这次京东更给力送了150京东豆。手机11月1号订的，3号下午到的。算了下5638到手。,"2017-11-04 03:37:17",25,5,248,0,105,,f***u,PLUS会员,2,来自京东iPhone客户端,1,3,"2017-11-01 23:17:22",0,NO_MESSAGE
5089267,fd2fb2f2-8ad3-49a1-a980-c8728bf8ee6e,comment,11084534777,还行吧，买个iPhone8就能接手女朋友的6s了。,"2017-12-18 18:44:34",30,5,271,0,61,,李***爷,银牌会员,4,来自京东Android客户端,1,1,"2017-12-17 18:09:19",0,NO_MESSAGE
5001213,de6384c8-500e-45d1-be58-193b85ce989f,comment,11800172726,我觉得很完美，做工手感都是很好的，屏幕也没有那么差，显示效果挺好的，配置就不用说啦，很流畅,"2018-08-12 21:30:42",0,5,0,0,105,,j***b,PLUS会员,4,来自京东Android客户端,1,16,"2018-07-27 11:22:12",0,NO_MESSAGE
8240587,1e2a56fa-8cbf-4e6c-a5ef-9bbb626833ef,comment,11800436072,超喜欢怎么物流，手机也很喜欢，非常有手感，刚拿回来就吃了几局吃鸡，感觉很快，发烫是正常的，但是真的不是很烫，稍微有一点点，非常满意，比****好多了。喜欢,"2018-08-12 23:06:42",0,5,1,0,61,,p***u,银牌会员,4,来自京东Android客户端,1,1,"2018-08-11 01:14:33",0,NO_MESSAGE
27357030125,cb678d99-8b15-404f-8897-70e01f49efae,comment,11325095509,"收到宝贝了 非常满意 和描述的一样 开机试了一下 物美价廉 支持国产手机 太强大了 各项功能都非常好 ? 非常好 非常喜欢","2018-03-19 22:09:49",0,5,0,0,62,,j***n,金牌会员,2,来自京东iPhone客户端,1,3,"2018-03-16 20:08:25",0,NO_MESSAGE
5089253,57796845-8998-4cf7-b3be-df8685f7c758,comment,11377736098,"终于降价了，果断下手，但是7K7还是肉痛啊！打游戏终于不卡了，我的iPhone6正式退役，i6兔子评分5W6，自己换了块电池变成7W6，iPhone X直接20W+哈！操作还在适应中，手下的悲伤，单手操作还是大了些。","2018-04-07 16:54:40",1,5,5,0,105,,無***-,PLUS会员,2,来自京东iPhone客户端,1,1,"2018-04-06 09:55:17",44,夏天到了，发热蛮厉害，烫了游戏就卡了，不知道怎么解。
7283905,e139a92b-8cdf-43b6-b3b3-063aba1f026f,comment,11795553692,"首先
运行内存4g。开机啥也不开只剩2g。
内存64g。但开机总内存只有54.15g。剩余46.26可用空间。明显不够64g。这点不知道为啥，。
其次说说充电，手机充电器头可能不是原配，也不是快充，但是速度可以，就是超级热超级烫手。分分钟感觉要自然一样。问了客服说正常。感觉很危险。其他都还可以，快递也很快。手感很棒。颜色完美。主要家长用。很担心安全问题，充电器太烫了！！！


对于买一款中端机器来说。还是选择了小米6x。年限不远。运行内存也是够父母亲用的。价钱也算可以。整体硬件比如像素和分辨率都比较强，处理器虽然中端但够用。","2018-08-11 13:40:57",0,5,0,0,61,,j***q,银牌会员,4,来自京东Android客户端,1,2,"2018-08-09 11:32:01",0,NO_MESSAGE
25158905369,b085158c-ac5c-47a9-870d-c6ecea4bf4ad,comment,11708603641,挺好的挺好的,"2018-07-16 08:54:43",1,5,0,0,56,,QwiXalUyHNSu,铜牌会员,21,来自微信购物,0,4,"2018-07-12 16:23:50",0,NO_MESSAGE
20349124505,fb4d9a76-d6c9-49e1-b160-c4537b40ba41,comment,11080598474,期待的10等了好多天终于到货了，真心不错，外观很漂亮，还没开始用，程序应该不错吧，在实体店看过的，货收到后碰到点小问题，卖家很耐心，也积极处理问题，让人感觉到信赖感，过程中碰到问题很正常，关键看卖家对待问题处理的态度和方法，给卖家点赞。,"2017-12-17 14:41:20",0,5,0,0,61,,j***4,银牌会员,4,来自京东Android客户端,1,5,"2017-12-12 21:09:48",0,NO_MESSAGE
5663902,74b0164c-a2e1-452e-b423-ee292c849a9c,comment,11769139166,挺不错的一部手机，就是荣耀不知道为什么价钱一降再降，敢将到，699吗？,"2018-08-03 11:49:28",1,5,0,0,105,,j***g,钻石会员,4,来自京东Android客户端,1,52,"2018-06-12 23:58:47",0,NO_MESSAGE
11339519481,4835a914-c286-4507-a5ea-198fd26d46ce,comment,11593277521,包装完好，早上下单晚上到，电子发票同时到，真牛!试机没问题，老人用正好，就是开机就没电了!送的壳不好，凑合吧！,"2018-06-14 20:25:02",0,5,0,0,105,,K***9,钻石会员,4,来自京东Android客户端,1,0,"2018-06-14 10:03:33",0,NO_MESSAGE
5942439,a9114635-9d7a-436d-9f83-e175b9e8c2f7,comment,11795887727,商品价格优惠电池耐用好好好好！！！！！！,"2018-08-11 15:26:08",0,5,0,0,105,,j***b,PLUS会员,4,来自京东Android客户端,1,29,"2018-07-13 14:43:34",0,NO_MESSAGE
7479912,bc633b6f-eda7-4023-89c1-c9dc556de724,comment,11800201225,手机很棒，可以满足我的日常需求，但是我发现在我用这手机玩艾希的时候开最高画质会出现一些卡顿。有点美中不足。。总之，就性价比来说是一款很好的手机。GT系统也很强大。。很满意。,"2018-08-12 21:40:22",0,5,0,0,61,,j***n,银牌会员,4,来自京东Android客户端,1,2,"2018-08-10 12:29:57",0,NO_MESSAGE
29638202857,58bcf93e-97f7-46de-94e9-9fb837d37f67,comment,11751489399,手机比实体店便宜，音质清晰，画面清晰，运行也快。,"2018-07-28 22:03:43",0,5,0,0,62,,菲***8,金牌会员,4,来自京东Android客户端,1,6,"2018-07-22 22:45:18",0,NO_MESSAGE
22863264117,45fccdce-7e26-4815-852e-37ef34400379,comment,11516032502,用着感觉还不错，来评价一下,"2018-05-24 18:17:37",0,5,0,0,105,,j***゛,PLUS会员,4,来自京东Android客户端,1,42,"2018-04-12 15:09:23",0,NO_MESSAGE
7534113,e9986b17-0f97-4c84-89eb-9fcd774c76e2,comment,11790297833,帮朋友买的，他满意就好了。,"2018-08-09 20:43:44",0,5,0,0,105,,蓝***霞,PLUS会员,4,来自京东Android客户端,1,9,"2018-07-31 21:21:46",0,NO_MESSAGE
5920651,07f1aea5-6645-42ba-8a52-3f4389fb2ca7,comment,11293300175,蛮好用的！性价比很好的一次购物！物流超级快！,"2018-03-09 06:39:45",0,5,0,0,61,,j***5,银牌会员,4,来自京东Android客户端,1,3,"2018-03-06 20:41:00",0,NO_MESSAGE
12764636413,3e01f94e-9343-49d2-b897-f87bdfdce8f7,comment,11721954826,机子很好用！国产大品牌，值得信赖！,"2018-07-20 00:57:07",0,5,0,0,61,,L***东,银牌会员,21,来自微信购物,0,5,"2018-07-15 15:02:21",0,NO_MESSAGE
5402840,b3fe6b49-2f5f-476e-bdf4-db6cb5cb3fab,comment,11765183635,买了三部飞利浦的手机了，质量杠杠的，挺好&hellip;,"2018-08-02 08:57:47",0,5,0,0,62,,阿***7,PLUS会员,4,来自京东Android客户端,1,2,"2018-07-31 23:18:53",0,NO_MESSAGE
28082716822,7cd6ece4-2585-41e9-af94-63cbd740dcc8,comment,11766906862,手机买回来用了有一段时间才发评论，手机很好用，上网不卡，价格也不贵，及得购买。,"2018-08-02 17:09:11",0,5,0,0,61,,j***r,银牌会员,4,来自京东Android客户端,1,41,"2018-06-22 19:00:55",0,NO_MESSAGE
7437788,fdab1689-e610-4769-be60-dde8fbbd6434,comment,11640804877,等了好久终于来啦！机子很新包装也挺好，不知道运行怎么样！使用后再来评价！,"2018-06-25 17:41:17",11,5,7,0,105,,京***白,PLUS会员,2,来自京东iPhone客户端,1,7,"2018-06-18 00:00:17",7,此用户未填写评价内容
25774787882,5bf450f8-c025-489b-9077-5e262eb3b530,comment,11774242228,不错，速度还是快，手机漂亮，就是照相像素不能和苹果的1200万像素比,"2018-08-04 22:40:02",1,5,0,0,61,,j***f,银牌会员,2,来自京东iPhone客户端,1,1,"2018-08-03 21:30:28",0,NO_MESSAGE
8484451,cc8b4675-9949-4a85-88b6-14b7648e6f4d,comment,11769133340,刚收到货，外观没得说，有待使用,"2018-08-03 11:47:46",2,5,3,0,62,,u***w,金牌会员,4,来自京东Android客户端,1,1,"2018-08-02 11:57:57",0,NO_MESSAGE
8239683,60f75602-802e-4b0d-83a6-648a966b8f8b,comment,11723672213,物流快！电话试用中！感觉挺好的！,"2018-07-20 15:15:53",0,5,2,0,62,,l***g,金牌会员,4,来自京东Android客户端,1,1,"2018-07-19 21:43:12",0,NO_MESSAGE
25834204287,2975d551-b065-4532-91a8-d8cf7fb1fc50,comment,11443654310,老公买的，刚开始使用，屏幕灵敏，手感不错。暂时没发现什么问题，除了刚充电的时候插上充电线没反应，后来换根线才充上。好评,"2018-04-30 21:38:51",2,5,1,0,105,,j***n,钻石会员,2,来自京东iPhone客户端,1,4,"2018-04-26 12:43:06",0,NO_MESSAGE
5853593,81e9ce53-1aa3-4c2e-96ec-43a27063df45,comment,11773830171,"华为荣耀V10绝对对得起国产强机的称号，首先拿到手里给人的感觉就是高大上，其次完全不用考虑比那些苹果三星差到哪儿，仅从外观上已经俘获了不少客户，给老婆买的第一台国产机，相信华为，最主要的是硬件配置这些都是值得称赞的，处理器用的华为最新研发的麒麟970 ，后置双摄像头200万像素+1600万像素，只能AI摄影，满足一机多拍的需求，前置摄像头也有1300万像素，无论是街拍美女帅哥或者是自拍都毫无压力，最后支持华为，支持国产！！！顺便一句京东快递神速，上午下单，下午送达！赞赞赞！！！","2018-08-04 20:14:24",1,5,0,0,105,,炫***族,PLUS会员,2,来自京东iPhone客户端,1,0,"2018-08-04 07:51:53",0,NO_MESSAGE
13521715420,d7b3d28e-5196-4bb7-a835-fe9209b2774b,comment,11678388353,还可以吧，将就用用，没用几天，还看不出来效果，现在性价比比较高,"2018-07-06 20:13:21",0,5,0,0,105,,j***5,钻石会员,4,来自京东Android客户端,1,17,"2018-06-19 12:18:22",0,NO_MESSAGE
7321794,8c3c35c3-5f98-4117-8785-21951af777c6,comment,11787107046,本来买了一个，屏幕阴阳屏，电视超级不耐用，通过售后，换了一个，处理速度非常快，郑州没货了就从北京给我调了一个，给力,"2018-08-08 21:32:10",0,5,0,0,61,,点***费,银牌会员,4,来自京东Android客户端,1,5,"2018-08-03 22:08:04",0,NO_MESSAGE
1592994,d17b2a35-ac9b-418a-84e8-33352712b1a9,comment,11790011343,手机很不错，老爸很喜欢，双屏不错，声音、按键都很大，非常不错。,"2018-08-09 19:08:01",0,5,0,0,105,,歌***星,钻石会员,0,,0,7,"2018-08-02 12:48:55",0,NO_MESSAGE
7437768,fd4750de-4a13-4ea2-90b7-764828a5aa40,comment,11801900053,机子今天刚到，感觉还可以吧！刚拍的时候说送耳机然而却没有，套装说两张贴膜也只有一张，有点被骗的感觉，包装泥就一盒子,"2018-08-13 13:08:39",0,5,0,0,61,,j***z,银牌会员,4,来自京东Android客户端,1,1,"2018-08-12 21:36:46",1,收货没用过就买了5小时变这样了
3901175,65710471-1ce4-4d82-990e-d290e54066f6,comment,11774650004,不怎么好，手机卡,"2018-08-05 07:51:13",0,5,0,0,61,,j***5,银牌会员,21,来自微信购物,0,37,"2018-06-29 07:49:55",0,NO_MESSAGE
6176077,ef43ebd6-682d-4865-8ed7-503882ef9ff1,comment,11761164004,不想说这个鸟手机了，买的第10天，开不了机，换货；换过后用了10天，开始发热，严重发热！不开任何程序自动发热，过下系统温馨提示，电池温度过高，第三次换货！用了7天重第六天开始，发热又来了,"2018-07-31 21:38:50",0,5,0,0,105,,骁***3,PLUS会员,4,来自京东Android客户端,1,36,"2018-06-25 21:44:50",36,打错星了，应该是差评
7081550,a09e4f40-fd3c-4458-9308-ff776a12e5ed,comment,11469025646,手机我就没有拍照了，因为我现在用的就是10，已经用了两天，整体给我的感觉是非常的棒，面部解锁功能，还有，全面屏。把荣耀展现的淋淋尽致。幻影蓝这个新款颜色，也是很新颖的。上一个手机是荣耀v8，两年了，还是运行自如，两年了，更新换代的荣耀，已经很完美了，最让我记忆犹新的功能，是手机通话自动录音功能，如果没这个功能的话，我想我跳进黄河都洗不清，谢谢华为！谢谢荣耀！,"2018-05-09 16:52:43",21,5,74,0,62,,S***8,PLUS会员,4,来自京东Android客户端,1,2,"2018-05-07 08:18:33",0,NO_MESSAGE
8344046,b6b0029b-a235-4702-a7c7-95f32e06434d,comment,11779135197,欺骗消费者，没有无线座充。,"2018-08-06 14:01:40",4,1,18,0,61,,君***生,银牌会员,0,,0,2,"2018-08-04 14:25:33",2,抱歉，是我没有看清楚，不能怪京东业务员，现在了解清楚了，服务人员已解释清楚。
5089275,e43d3a98-a1f1-4f31-9571-b67cf9618d2f,comment,11575608004,第一次收到有点小瑕疵，虽然售后帮忙检查了下，说不影响使用，但是，还是决定换一个，售后和客服都很耐心，?赞，审核很快，其他的卡一看照片和视频，目前还没用，性能方面使用之后做评价。最后有一点，之前用过6S没记得激活之后浏览器主页就有好几个标签啊，不知道你们遇到过没有，之前好像只有一个apple的官网标签。,"2018-06-10 11:36:25",22,5,53,0,105,,S***r,PLUS会员,4,来自京东Android客户端,1,9,"2018-06-01 00:00:24",0,NO_MESSAGE
5089267,fd2fb2f2-8ad3-49a1-a980-c8728bf8ee6e,comment,11525208987,手机收到了，是新机，第一次用苹果，系统流畅，外观漂亮完美,"2018-05-27 17:03:16",1,5,3,0,61,,j***e,PLUS会员,4,来自京东Android客户端,1,3,"2018-05-24 14:40:00",0,NO_MESSAGE
5001213,de6384c8-500e-45d1-be58-193b85ce989f,comment,10854741189,虽然我是米粉，但是对于这台手机，我不得不来吐槽，MIX2所标榜的就是它的全面屏设计和无边框的视觉效果，但实物的边框看起来不是很窄，颜值和一代比差了不止一倍，另外这台手机标榜的就是全面屏2.0，但最让我感到失望的也是这块屏幕，和我的小米5s相比不但是解析度不够，屏幕显示自然色偏黄，冷色调偏红，10/1之前拿到手之后就急急忙忙出国了，要不然真会想把这台手机给退了，除了以上缺点之外，手机的硬件功能没话说，处理器速度快省电，缓存容量大跑起来很顺畅。只能说这次雷军为了手机的销量，对产品工艺上的要求妥协了。,"2017-10-12 17:48:20",8,3,18,0,105,,e***4,PLUS会员,4,来自京东Android客户端,1,21,"2017-09-21 00:01:35",0,NO_MESSAGE
8240587,1e2a56fa-8cbf-4e6c-a5ef-9bbb626833ef,comment,11801594000,"按键不是很灵活，额外买了保护膜，按键就更加不灵敏了，要按好多下，而且要很大力按才行，不够现在用的oppo按键好用。
没有
刘海还是很多。
指纹锁还没有使用。
电源键按键不灵敏，关机太麻烦了，得按好几下，而且不是一键关机，按了一下，还得确认一下，麻烦。
自带软件太多。
包装太小气了，就一个袋子套这一个盒子。
也许是不是活动，什么小礼品都没有。
拍照感觉亮光和自拍不够oppo的好，暗光下拍照效果还好。
音乐很低沉。
有遥感装置，可以显示每天行走多少步。现在用的oppor7s是没有这个装置的。
其他的还没有用。
目前使用的按键非常的不灵敏，有一点点后悔买了，现在想买oppo最新那款了。
希望电量，和后续的反应不要那么令我失望。忍忍吧，2-3年很快就过去了。","2018-08-13 11:39:35",0,5,0,0,61,,S***羊,银牌会员,4,来自京东Android客户端,1,10,"2018-08-03 15:34:47",0,NO_MESSAGE
27357030125,cb678d99-8b15-404f-8897-70e01f49efae,comment,11642928040,真心不好好像是高仿的昨天收到用了就自己闪退还有卡死了不像是4G的运行大家别卖,"2018-06-26 10:35:55",0,5,0,0,105,,s***9,PLUS会员,21,来自微信购物,0,5,"2018-06-21 11:00:34",0,NO_MESSAGE
5089253,57796845-8998-4cf7-b3be-df8685f7c758,comment,11237623005,"京东还是挺不错的，虽然比找下贵了6-700，但是抢到一张24期免利息，也不错，挺给力的

说下手机，拿到手朋友还是很羡慕的，给媳妇了，我只能拿她的7用用了，整体感觉不错，面部识别效果很好，运行速度挺棒的，拍照也好，整体现在没有任何问题，就是本人的英用有的是英文的，看不懂，都整理在一个档案夹里了，删除也删不掉，我也用不着
京东下单快递还是很给力的，下午4点下单，第二天11点多就到了，一共还不超过20个小时，这个必须赞?下","2018-02-10 16:46:56",34,5,66,0,61,,樂***密,银牌会员,4,来自京东Android客户端,1,1,"2018-02-09 16:10:15",0,NO_MESSAGE
7283905,e139a92b-8cdf-43b6-b3b3-063aba1f026f,comment,11594229128,"连续试用了3小时，手机反应速度快，安装APP速度快。
指纹解锁超快3小时才用了15%的电量，超省电
系统试用需要慢慢适应，总体来说很不错。可以入手。

不足:
1手机很薄，摄影头有2mm突出。(不过带上官方手机套不明显)
2系统的最近使用任务跟魅族系统差远了
3一样是三星的屏幕，没有我魅族的息屏显示(锁屏了，在黑屏时显示时间日期)&mdash;&mdash;不过很多手机都是没有的。
4小米的系统在安装APP时，中间总是出现一个推荐其他APP安装的广告。(虽然不是恶意广告，但我看着就不爽)","2018-06-15 07:43:58",18,5,11,0,105,,x***y,钻石会员,4,来自京东Android客户端,1,2,"2018-06-13 16:09:24",0,NO_MESSAGE
25158905369,b085158c-ac5c-47a9-870d-c6ecea4bf4ad,comment,11797858771,手机不错。尤其是配置还是高通的cpu，我很满意。,"2018-08-12 09:36:05",1,5,0,0,105,,三***定,钻石会员,4,来自京东Android客户端,1,28,"2018-07-15 10:34:12",0,NO_MESSAGE
