sku_id,_id,item_name,comment_id,content,creation_time,reply_count,score,useful_vote_count,useless_vote_count,user_level_id,user_province,nickname,user_level_name,user_client,user_client_show,is_mobile,days,reference_time,after_days,after_user_comment
5853593,bf8a73cc-8083-41f1-bc4e-a898769220f6,comment,11609174711,两次售后申请如下：①16号下的单，今天刚收到的手机，一打开，全是灰尘。本来以为只是快递运输过程中不小心把灰尘弄到包装盒表面了。可是撕开包装盒表面塑料薄膜打开包装一看，里面还是很多灰尘。打开包装盒拿出手机，手机屏幕表面很多指纹手印，而且包装盒都是折痕，尤其是那个放取卡针的地方折痕尤其明显。再认真看充电口，发现充电口里头有条白色的塑料条。而且充电口里面被白色塑料条顶得拱起来变形了，最气人的是指纹下面的屏幕边缘居然有磨损和小裂纹。把别人用过的二手货发给我，亏我一直支持京东，网购都选择京东自营。真的是太气人了。我申请换货，不要再发破损的二手货给我了。不然直接退货退款。②再次反馈一下问题。只是反馈问题，因为没有其他渠道能上传图片，所以才来这个渠道。手机既不用退换货也不用维修。我只是借这个渠道反馈问题而已。申请换货后，今天收到货了，打开包装后，检查了一下手机，手机这次没问题。但是内部包装有问题，明显被人动过了，你们自己看这上传的图片，因为限制只能发一张，所以发了这样最明显的。说明书和TPU保护壳等本来应该放在袋子里的东西都被拿出来了。放取卡针的地方有明显折痕。放充电器接头的地方完全被压塌且破损。,"2018-06-18 19:46:32",19,1,59,0,62,,凯***n,金牌会员,4,来自京东Android客户端,1,2,"2018-06-16 18:06:30",0,NO_MESSAGE
28082716822,6ce38e6e-6514-4405-a3dc-df3f608d0ceb,comment,11808469922,此用户未填写评价内容,"2018-08-15 12:58:06",0,5,0,0,105,,唐***良,钻石会员,2,来自京东iPhone客户端,1,1,"2018-08-14 00:06:21",0,NO_MESSAGE
26266694915,35c3340c-3823-4f0b-93ad-91e687d9f6ec,comment,11788020184,刚开始挑选时，看到6.28英寸，还担心太大不好使用。外观很漂亮，手感很好。自己买了后，朋友看到试用效果好，让我也帮忙订了一款。,"2018-08-09 09:33:27",0,5,0,0,105,,江***9,钻石会员,0,,0,16,"2018-07-24 13:45:46",0,NO_MESSAGE
5402840,682fb86f-9d67-4f98-b8a1-aa89d7fdd759,comment,11763955489,送老人家的，好像不错！,"2018-08-01 18:46:01",0,5,0,0,105,,L***9,PLUS会员,2,来自京东iPhone客户端,1,12,"2018-07-20 22:55:15",0,NO_MESSAGE
7651903,b38dc629-16ac-4aac-acc9-a76e130210bb,comment,11757624847,雷老板出的小米手机我还是很信任的，红米手机系列的价格是让我们这些学生族非常能接受的，电池非常耐用，各方面的性能远远超过了这个价位，物流更是没得说，头一天晚上下单，第二天中午就到了，总之，非常棒棒哒！,"2018-07-30 20:30:37",0,5,1,0,61,,j***b,银牌会员,4,来自京东Android客户端,1,33,"2018-06-27 19:49:12",0,NO_MESSAGE
15612619462,bbce111c-7ca8-4d2d-875c-07d496985241,comment,11770100686,手机不错，触屏挺灵的，外观也好看！性价比高,"2018-08-03 16:49:55",1,5,0,0,61,,j***o,银牌会员,4,来自京东Android客户端,1,4,"2018-07-30 10:18:33",0,NO_MESSAGE
29619588672,a747dafb-84ad-442d-9411-448bcfc8f7c0,comment,11765953965,能开空调电量打是我最喜欢的，手机其实还是比较卡的，,"2018-08-02 12:16:38",0,5,0,0,61,,吾***爷,银牌会员,4,来自京东Android客户端,1,31,"2018-07-02 12:51:40",0,NO_MESSAGE
21135280362,d45b431c-4fce-4f38-96a0-492b38691a03,comment,11485065042,产品很不错使用还可以,"2018-05-15 05:46:58",0,5,0,0,56,,j***4,铜牌会员,4,来自京东Android客户端,1,4,"2018-05-11 06:28:47",0,NO_MESSAGE
7694047,002c02b5-3240-4ee8-b31d-949c83ee6df5,comment,11657390069,"目前没有什么不好的手感什么的不错使用也不错质量非常好，与卖家描述的完全一致，非常满意,真的很喜欢，完全超出期望值，发货速度非常快，包装非常仔细、严实，物流公司服务态度很好，运送速度很快，很满意的一次购物很多时候高颜值往往只跟高价的旗舰机相匹配，而千元机基本没有什么看点，大部分都是入门的配置和平庸的设计，然而最近发布的荣耀9i，相信这是会改变了很多人以往的看法。荣耀9i将于7月支持GPU Turbo，大家可以试试。","2018-06-30 14:29:55",1,5,6,0,61,,c***8,银牌会员,4,来自京东Android客户端,1,1,"2018-06-29 10:01:38",0,NO_MESSAGE
7846413,7373d0cf-530f-43ca-83b5-71df28158824,comment,11596507615,黑色真漂亮，满满苹果x的知道，就是到货时间太久了,"2018-06-15 17:58:10",0,5,1,0,105,,镇***导,PLUS会员,2,来自京东iPhone客户端,1,10,"2018-06-05 10:00:18",0,NO_MESSAGE
11107032701,12e25c2a-c4c7-46d6-bc82-e54a05f6191f,comment,11148554863,接个视频半天都反应不过来,"2018-01-11 09:21:11",0,5,0,0,61,,j***t,银牌会员,4,来自京东Android客户端,1,38,"2017-12-04 12:57:52",0,NO_MESSAGE
26263258528,5a3add27-19ca-445d-84ea-e2202d347a1b,comment,11656880277,屏幕挺大的，手感不错，壳就是有点松,"2018-06-30 11:51:19",0,5,0,0,56,,f***s,铜牌会员,22,来自手机QQ购物,0,7,"2018-06-23 08:56:52",0,NO_MESSAGE
5019352,939a4094-85d2-4e0a-a401-2526420b87a1,comment,11790842029,给老爷子买的，到目前为止很满意。,"2018-08-10 00:17:09",0,5,0,0,105,,s***d,PLUS会员,4,来自京东Android客户端,1,14,"2018-07-27 09:24:10",0,NO_MESSAGE
7651927,af7bc35d-5a14-42a4-a7d3-34fd1da6d9f3,comment,11808159997,第一次购买的，网络信号弱，换了一部新的。颜值也不错。给妈妈买的。她挺满意！,"2018-08-15 11:27:59",0,5,0,0,105,,j***o,钻石会员,2,来自京东iPhone客户端,1,14,"2018-08-01 11:51:48",0,NO_MESSAGE
29196113704,c0ea0d11-b8fa-4995-adde-b827a58cf877,comment,11786332043,喜欢小米这个品牌，性价比高，对于老人家来说完全够用,"2018-08-08 17:09:46",0,5,0,0,105,,j***0,PLUS会员,4,来自京东Android客户端,1,2,"2018-08-06 11:50:55",0,NO_MESSAGE
16290978197,467d6f78-3296-4b8c-a66a-5c21d35a496e,comment,11433342285,用了几天来评价，这款机子的性价比挺高的，给个好评，店家也比较实在，送的东西挺多；特别是有一年的保修服务和一年的影视会员；,"2018-04-27 01:41:35",0,5,0,0,62,,高***风,金牌会员,0,,0,14,"2018-04-13 15:00:44",0,NO_MESSAGE
28714523786,9078ee8f-5e9e-45fc-9bb6-0431bd4a64b7,comment,11786969268,到安徽隔天就收到，物流太快了，手机看着很好，比实体店便宜，希望耐用,"2018-08-08 20:48:10",1,5,0,0,61,,楼***9,银牌会员,4,来自京东Android客户端,1,1,"2018-08-07 21:10:00",0,NO_MESSAGE
19078286246,cc25004e-3bb3-4ab0-8256-e02a912563e7,comment,11793511150,布不错,"2018-08-10 20:05:20",0,5,0,0,61,,为***3,银牌会员,4,来自京东Android客户端,1,2,"2018-08-08 01:15:12",0,NO_MESSAGE
5375693,5c3096e5-2471-427d-8d52-811107f9ffe3,comment,11790437210,感觉还是满好的，用起也好用。,"2018-08-09 21:26:37",0,5,0,0,61,,j***0,银牌会员,4,来自京东Android客户端,1,3,"2018-08-06 18:28:55",0,NO_MESSAGE
21845662740,a09ddbf0-193e-4ad3-9d9c-aca2c6ad30bc,comment,11765816473,使用中，后期在来评,"2018-08-02 11:35:27",0,5,0,0,62,,j***7,PLUS会员,4,来自京东Android客户端,1,4,"2018-07-29 00:20:00",0,NO_MESSAGE
25531193076,4416d650-48e4-4ed5-a449-5713356d6e11,comment,11775460515,从订单到送达，总共才一天半时间，今早八点多就送到我小区快递柜。很快，谢谢你们。还没用，应该很好，我相信！,"2018-08-05 11:52:30",0,5,0,0,61,,j***x,PLUS会员,4,来自京东Android客户端,1,2,"2018-08-03 10:11:29",0,NO_MESSAGE
28328600610,df6c026d-6a17-4305-a6d4-e8df1b4dce25,comment,11744669414,很快就收到货了，仔细看过，外包装膜有点粗糙，手机屏是裸屏，串号查过，保修状态查过，到售后也问了一下，一切都没有问题，总之便宜实惠，老人用很合适！用用观察一下再末评价！,"2018-07-26 18:56:26",0,5,0,0,61,,j***g,银牌会员,4,来自京东Android客户端,1,2,"2018-07-24 16:35:25",0,NO_MESSAGE
5663902,9d7e7a0a-8c25-456e-aa61-8a22f88f01b4,comment,11792414375,电池续航能力很强,"2018-08-10 14:13:33",0,5,0,0,56,,那***M,铜牌会员,4,来自京东Android客户端,1,25,"2018-07-16 12:27:58",0,NO_MESSAGE
11339519481,24ee8b94-4ff2-48d1-bf35-54778b493b69,comment,11409881540,手机给我妈买的，她说挺好的，蛮喜欢的,"2018-04-18 23:56:11",1,5,0,0,62,,盏***凉,PLUS会员,2,来自京东iPhone客户端,1,3,"2018-04-15 15:24:09",0,NO_MESSAGE
5942439,525ee525-c731-40c2-b6e9-7502f74a0065,comment,11791047141,"质量不行，买回来几天喇叭就坏了。
也不知道联系谁？看看能不能修？","2018-08-10 07:31:06",0,5,0,0,56,,jd_152226yir,铜牌会员,4,来自京东Android客户端,1,48,"2018-06-23 07:25:19",0,NO_MESSAGE
26697273746,73218e2a-323b-404c-bb17-0378739f1ad0,comment,11387356608,可以，什么都好用,"2018-04-11 00:24:27",0,5,1,0,61,,剑***索,银牌会员,4,来自京东Android客户端,1,3,"2018-04-08 00:09:06",0,NO_MESSAGE
12764636413,0ce34c5c-5cc0-4411-b671-0b8938ddcd44,comment,11775419376,是正品，不错。也很流畅，不愧为小米最精典手机,"2018-08-05 11:40:33",0,5,0,0,62,,洋***虑,金牌会员,0,,0,37,"2018-06-29 22:17:10",0,NO_MESSAGE
22863264117,1729e427-0cf5-4425-a1b1-4b97dc2e5ebd,comment,11348513705,还行，用着感觉还不错,"2018-03-27 23:55:22",1,5,0,0,61,,R***T,银牌会员,21,来自微信购物,0,27,"2018-02-28 17:08:23",0,NO_MESSAGE
29638202857,c0106c4c-4f38-470d-9f7e-f8c4d4d07160,comment,11712458268,运行速度还行，就是有时有点卡。,"2018-07-17 10:16:15",0,5,0,0,105,,p***y,钻石会员,4,来自京东Android客户端,1,10,"2018-07-07 10:00:34",0,NO_MESSAGE
25158905369,c4ae243e-d8da-4016-832b-c9dbd360940e,comment,11701117735,挺好的这手机,"2018-07-13 20:34:16",1,5,1,0,56,,Y***i,铜牌会员,22,来自手机QQ购物,0,4,"2018-07-09 18:39:16",0,NO_MESSAGE
7479912,40de71b7-640b-4c7f-bdc7-b154a2480d0b,comment,11795955847,还不错，性价比高，运行流畅。,"2018-08-11 15:47:46",0,5,0,0,105,,D***d,PLUS会员,4,来自京东Android客户端,1,1,"2018-08-10 00:12:32",0,NO_MESSAGE
20349124505,45a986b3-4991-4511-83f8-10ce26459824,comment,11005613331,好评！京东商城的东西就是好！值得信赖下次继续在京东购物！店家服务态度好！值得信赖,"2017-11-23 13:20:54",0,5,0,0,105,,久***i,PLUS会员,4,来自京东Android客户端,1,7,"2017-11-16 20:18:42",0,NO_MESSAGE
30153140071,bc192861-311a-406b-bdca-e427882a345e,comment,11778867737,挺好的，不错哦,"2018-08-06 12:40:25",1,5,0,0,56,,先***亮,铜牌会员,0,,0,3,"2018-08-03 16:22:11",0,NO_MESSAGE
30323689521,a58eb0bc-05e9-4d98-a35b-31f05fc86c83,comment,11006944468,不错，京东会员便宜了400块钱，支持华为,"2017-11-23 20:06:05",0,5,0,0,105,,j***k,钻石会员,2,来自京东iPhone客户端,1,85,"2017-08-30 19:34:23",0,NO_MESSAGE
7437788,87169183-32b2-4912-8560-b3b45bca094a,comment,11635871257,"6.18晚上8点钟抢的，那是抢的第三次，然后每一次都是让几个朋友一起抢的。618那天晚上我就不信还不能抢到，借鉴前面一些米粉的方法，就硬抢了半个小时。
结果我朋友那儿先抢到了，晚上才发现我这购物车也抢到了一台！哈哈，嗯，具体时间25号送到，结果今儿24日就到了！嗯，还不错！
朋友一直推荐小米。","2018-06-24 13:20:48",12,5,14,0,62,,梦***处,PLUS会员,4,来自京东Android客户端,1,6,"2018-06-18 20:00:07",0,NO_MESSAGE
28672267256,31237d2d-c1c8-4cff-b700-74d0f3b62774,comment,11658629609,很开心手机很好用，运行流畅，机型完美。就是喜欢。,"2018-06-30 21:11:28",0,5,0,0,105,,救***魂,PLUS会员,4,来自京东Android客户端,1,4,"2018-06-26 22:59:28",0,NO_MESSAGE
5920651,789acf14-078d-46a4-aa58-bf7b1694911d,comment,11293921944,手机不错，物美价廉！,"2018-03-09 11:09:02",0,5,0,0,62,,f***1,金牌会员,21,来自微信购物,0,21,"2018-02-16 12:30:41",0,NO_MESSAGE
25774787882,6638b96a-6a5e-4b12-ad5c-6b9d4d0ac60e,comment,11774841352,手机外观不错，吃鸡很高大上，不卡，流弊哄哄,"2018-08-05 09:12:59",1,5,0,0,61,,谁***梦,PLUS会员,2,来自京东iPhone客户端,1,4,"2018-08-01 16:50:19",0,NO_MESSAGE
8484451,89c850da-d224-4a80-be13-13d92db53ec2,comment,11770837755,此用户未填写评价内容,"2018-08-03 21:09:11",0,5,1,0,56,,A***M,铜牌会员,4,来自京东Android客户端,1,1,"2018-08-02 10:12:16",0,NO_MESSAGE
7534113,605df6db-c592-42a9-a714-f660bba5e181,comment,11789164376,公司买的测试机，经济实惠，解决开发测试用机的麻烦,"2018-08-09 14:44:42",0,5,0,0,105,,l***9,PLUS会员,2,来自京东iPhone客户端,1,50,"2018-06-20 11:00:35",0,NO_MESSAGE
8239683,3ea6ca31-7021-4415-8d07-b28aa8a4c94e,comment,11718575346,"货收到用了两天才来评价
拍照还行，电池续航一天半不玩游戏
内存太小
 卸下几个应用装了几个应用就说满了
让卸载多余不常用的软件
别的都可以吧","2018-07-19 00:25:03",0,5,0,0,56,,j***p,铜牌会员,2,来自京东iPhone客户端,1,4,"2018-07-15 23:28:28",0,NO_MESSAGE
25834204287,82bdff8f-a87d-49ec-a0a2-4adcabba51ef,comment,11472286178,手机挺好！优惠了不少，中间出了点差错，客服人员很用心，值得表扬！给100个赞！,"2018-05-10 18:40:35",1,5,1,0,62,,L***W,金牌会员,2,来自京东iPhone客户端,1,14,"2018-04-26 15:05:08",0,NO_MESSAGE
29242522476,772ac373-1937-4a4e-b13e-21ef288a5a8f,comment,11741014533,此用户未填写评价内容,"2018-07-25 17:37:55",0,5,0,0,61,,P***8,银牌会员,4,来自京东Android客户端,1,6,"2018-07-19 14:18:11",0,NO_MESSAGE
5853593,bf8a73cc-8083-41f1-bc4e-a898769220f6,comment,11793887018,这几年的用的手机都是华为系列的，用过荣耀8。这次给老爸买手机一直在荣耀10、note10和v10之间纠结，最后还是选择v10，总体来说很不错，老爸很喜欢。,"2018-08-10 22:09:37",0,5,0,0,105,,黑***2,钻石会员,4,来自京东Android客户端,1,0,"2018-08-10 08:51:06",0,NO_MESSAGE
28082716822,6ce38e6e-6514-4405-a3dc-df3f608d0ceb,comment,11807434651,此用户未填写评价内容,"2018-08-15 08:11:03",0,5,0,0,62,,4***0,金牌会员,2,来自京东iPhone客户端,1,4,"2018-08-11 10:34:18",0,NO_MESSAGE
26266694915,35c3340c-3823-4f0b-93ad-91e687d9f6ec,comment,11771580614,很好用，打游戏很好，送的耳机很好听音乐，看视频效果超好,"2018-08-04 08:26:03",0,5,0,0,61,,j***6,银牌会员,21,来自微信购物,0,4,"2018-07-31 19:31:26",0,NO_MESSAGE
5402840,682fb86f-9d67-4f98-b8a1-aa89d7fdd759,comment,11769238432,手机收到了，非常喜欢,"2018-08-03 12:20:26",0,5,0,0,61,,宝***刘,PLUS会员[试用],4,来自京东Android客户端,1,1,"2018-08-02 16:58:37",0,NO_MESSAGE
7651903,b38dc629-16ac-4aac-acc9-a76e130210bb,comment,11774332697,应该说物超所值啊，照片清晰度可以跟苹果?抗洪，但是价格只有其几分之一，拍照截屏速度(○?&epsilon;?○)，旅游也可以拍，看西红柿首富也可以，省钱?，还能吃喝玩乐，买买买，不需要再买苹果?与三星，华为与魅族最近都买过，一个月买了三台国产手机，还是小米手机最佳性价比，小爱同学很灵敏，玩游戏还是买高端的，拍照够了。,"2018-08-04 23:19:56",0,5,0,0,62,,c***d,金牌会员,4,来自京东Android客户端,1,15,"2018-07-20 04:49:43",0,NO_MESSAGE
15612619462,bbce111c-7ca8-4d2d-875c-07d496985241,comment,11772260236,为什么一开机就这样？动都动不了怎么回事？,"2018-08-04 11:33:19",1,5,0,0,61,,j***2,银牌会员,4,来自京东Android客户端,1,2,"2018-08-02 13:15:52",0,NO_MESSAGE
29619588672,a747dafb-84ad-442d-9411-448bcfc8f7c0,comment,11783834632,很快很方便，以后还会买。,"2018-08-07 21:22:10",0,5,0,0,105,,p***r,PLUS会员,2,来自京东iPhone客户端,1,4,"2018-08-03 18:05:49",0,NO_MESSAGE
21135280362,d45b431c-4fce-4f38-96a0-492b38691a03,comment,11747923072,买给爸爸用的，金色的，爸爸很喜欢，有送数据线，手机壳还有钢化膜和手机扣，手机运行蛮快的，还是很信任国产手机,"2018-07-27 19:06:42",0,5,0,0,61,,涵***i,银牌会员,2,来自京东iPhone客户端,1,14,"2018-07-13 17:56:11",0,NO_MESSAGE
7694047,002c02b5-3240-4ee8-b31d-949c83ee6df5,comment,11688886377,给女朋友买的手机，她很喜欢。反应特别快，拍照清晰，WIFI信号很好，性价比很高，值得推荐购买。,"2018-07-10 07:41:27",1,5,4,0,105,,刘***8,PLUS会员,4,来自京东Android客户端,1,3,"2018-07-07 09:50:11",0,NO_MESSAGE
7846413,7373d0cf-530f-43ca-83b5-71df28158824,comment,11711515249,手机很好用，很轻，才用几天，各种功能都没摸熟，但确实性价比很高,"2018-07-16 22:33:13",2,5,0,0,61,,j***q,银牌会员,4,来自京东Android客户端,1,6,"2018-07-10 10:00:08",0,NO_MESSAGE
11107032701,12e25c2a-c4c7-46d6-bc82-e54a05f6191f,comment,11143608762,很好的手机，很适合老人,"2018-01-09 12:50:13",0,5,0,0,62,,m***n,金牌会员,2,来自京东iPhone客户端,1,20,"2017-12-20 21:05:29",0,NO_MESSAGE
5019352,939a4094-85d2-4e0a-a401-2526420b87a1,comment,11789097558,用了几天了，挺好，性价比很高！,"2018-08-09 14:24:36",0,5,0,0,105,,j***i,PLUS会员,4,来自京东Android客户端,1,15,"2018-07-25 09:36:09",0,NO_MESSAGE
16290978197,467d6f78-3296-4b8c-a66a-5c21d35a496e,comment,11407389779,买来送人的，还没交流使用感受，应该好用吧，只是原来以为华为手机充电接口是一样的，实际上不是，有点遗憾。,"2018-04-18 09:02:48",1,5,0,0,105,,j***0,钻石会员,4,来自京东Android客户端,1,3,"2018-04-15 08:47:47",0,NO_MESSAGE
28714523786,9078ee8f-5e9e-45fc-9bb6-0431bd4a64b7,comment,11601361833,手机很好，使用一切正常，运行也很流畅，价格也很适中。,"2018-06-17 00:16:28",1,5,0,0,105,,易***子,PLUS会员,4,来自京东Android客户端,1,5,"2018-06-12 16:06:50",0,NO_MESSAGE
19078286246,cc25004e-3bb3-4ab0-8256-e02a912563e7,comment,11755593447,很不错,"2018-07-30 10:18:38",0,5,0,0,62,,j***o,金牌会员,4,来自京东Android客户端,1,10,"2018-07-20 08:13:13",0,NO_MESSAGE
5375693,5c3096e5-2471-427d-8d52-811107f9ffe3,comment,11780460224,后壳比较难拆下，电池不大耐用，无话费时拨打只提示无法连接，不会提示余额不足,"2018-08-06 20:56:34",0,5,0,0,105,,k***1,PLUS会员,4,来自京东Android客户端,1,15,"2018-07-22 08:05:51",0,NO_MESSAGE
21845662740,a09ddbf0-193e-4ad3-9d9c-aca2c6ad30bc,comment,11792193609,还不错，每天下班回来就抱着手机玩了,"2018-08-10 13:05:08",0,5,0,0,62,,0***心,金牌会员,4,来自京东Android客户端,1,12,"2018-07-29 03:31:57",0,NO_MESSAGE
25531193076,4416d650-48e4-4ed5-a449-5713356d6e11,comment,11482162591,那时候想了好久都不知道买什么款的手机，后来选择这款荣耀V10，收到了货了打开手机觉得自己不会用，本来想退的，还好没有退，可能是刚开始不习惯用，，用了一个多月，觉得很不错，还送一些可以用的东西。用了一个多月现在才来评价的。支持国产。,"2018-05-14 09:18:41",1,5,0,0,61,,j***j,银牌会员,4,来自京东Android客户端,1,28,"2018-04-16 13:38:13",0,NO_MESSAGE
28328600610,df6c026d-6a17-4305-a6d4-e8df1b4dce25,comment,11727147772,此用户未填写评价内容,"2018-07-21 16:16:39",0,3,0,0,105,,j***5,钻石会员,2,来自京东iPhone客户端,1,19,"2018-07-02 11:54:53",0,NO_MESSAGE
8344046,f97a1fc5-86ed-4072-a291-da3800ca8bb6,comment,11800376764,此用户未填写评价内容,"2018-08-12 22:41:57",0,5,0,0,62,,子***8,金牌会员,2,来自京东iPhone客户端,1,2,"2018-08-10 22:11:24",0,NO_MESSAGE
5663902,9d7e7a0a-8c25-456e-aa61-8a22f88f01b4,comment,11791128654,"用了三年多的荣耀6P因为充电头有问题，不得已更新手机！真心夸赞荣耀6P！
因为属轻度用机，所以选择了荣耀7X标配版，基于够用价低的原则！
首次被京东的物流速度惊了！8号晚9:11下单，第二天10点多一点到手！赞+10086
手机包装完好。封签完好！打开后，按键牢靠无旷动。屏占比很大！感觉瘦长，对我来说有点不习惯，也许时间长了会好受吧！电源键、音量键、后置摄像头凸出的有点过了，揣在兜里害怕误触按键。一点遗憾吧！
使用了一晚上，整体感觉不错！打电话非常清晰，估计也与移动HD的volte有关吧！通话清晰了，可是，手机上部靠耳朵位置发热厉害。不合适长聊！
手机的速度还行，屏幕触摸也比较灵敏流畅！画面的清晰度很棒，照片也好！指纹解锁也很棒！
少许遗憾的就是，18:9的屏占比，对文字显示让我很不习惯，看网页时画面优化的不好！
对了，这手机竟然没有一键锁屏，感觉越做越倒回去了！这是我最大的遗憾吧！
整体来说，这款手机还是非常合我意，对得起这939的价格吧！全部*****5分好评！","2018-08-10 08:20:26",0,5,0,0,61,,b***h,银牌会员,0,,0,2,"2018-08-08 20:30:55",0,NO_MESSAGE
11339519481,24ee8b94-4ff2-48d1-bf35-54778b493b69,comment,11463423077,还不错，和图片一样，用一阵子再说,"2018-05-07 18:44:49",1,5,0,0,62,,j***v,PLUS会员,4,来自京东Android客户端,1,6,"2018-05-01 20:20:20",0,NO_MESSAGE
5942439,525ee525-c731-40c2-b6e9-7502f74a0065,comment,11807198221,物流快，服务快，服务度100分这是第二次买，实用，老人喜欢的款,"2018-08-15 00:36:00",0,5,0,0,61,,j***6,银牌会员,4,来自京东Android客户端,1,2,"2018-08-13 07:26:47",0,NO_MESSAGE
26697273746,73218e2a-323b-404c-bb17-0378739f1ad0,comment,11802069668,宝贝收到很喜欢，跟商家说的也一样，等用一段时间在评论,"2018-08-13 14:00:50",0,5,0,0,61,,j***4,银牌会员,21,来自微信购物,0,3,"2018-08-10 10:58:46",0,NO_MESSAGE
5001213,52130c11-6c1a-434e-8558-7c3c735632a9,comment,11764056135,"首先屏幕看上去非常爽 性能方面本人不怎么玩游戏所以咱不评价 还有快递特别快 头一天中午订的 第二天上午就到了 总的来说十分满意 支持小米～","2018-08-01 19:23:40",0,5,1,0,61,,L***x,银牌会员,4,来自京东Android客户端,1,1,"2018-07-31 12:45:59",0,NO_MESSAGE
8240587,f51bd102-987b-4f11-a8e6-56e4325ee8f0,comment,11792184095,昨天下的单今天送到的，考虑的很久才选的这款，刚入手还不错，先用一段时间再评论吧。,"2018-08-10 13:02:25",0,5,0,0,62,,欧***文,金牌会员,4,来自京东Android客户端,1,1,"2018-08-09 17:22:30",0,NO_MESSAGE
5089267,bfeee25d-b4be-410b-a9b4-ef6f8a28f573,comment,10930382270,"说实话  这手机我并不满意，第一手机用电是真的相当快，基本上普通的开数据网络，只能用四个小时，半天就没电了  续航能力是太差了，第二，有时候触屏还有点不灵，还要按好几次，第三，听音乐手机手机震动太大了，音质不好，而且手机充电也慢，比安卓手机差的太远了，要是能退款的，我马上就退了 。激活不能退了，唉。","2017-11-06 09:47:59",16,3,22,0,62,,鼬***遇,PLUS会员,4,来自京东Android客户端,1,5,"2017-11-01 09:14:53",0,NO_MESSAGE
12764636413,0ce34c5c-5cc0-4411-b671-0b8938ddcd44,comment,11721363534,手机很漂亮，下次有机会继续来京东购买哦。,"2018-07-19 20:36:49",0,5,0,0,62,,j***生,金牌会员,4,来自京东Android客户端,1,22,"2018-06-27 21:04:16",0,NO_MESSAGE
22863264117,1729e427-0cf5-4425-a1b1-4b97dc2e5ebd,comment,11307890124,质量好好好好好好,"2018-03-14 06:08:25",1,5,0,0,105,,k***5,PLUS会员,0,,0,52,"2018-01-21 14:08:34",0,NO_MESSAGE
29638202857,c0106c4c-4f38-470d-9f7e-f8c4d4d07160,comment,11711394360,东西己收到，很漂亮，很喜欢,"2018-07-16 21:53:55",0,5,0,0,61,,j***w,银牌会员,4,来自京东Android客户端,1,5,"2018-07-11 12:21:27",0,NO_MESSAGE
25158905369,c4ae243e-d8da-4016-832b-c9dbd360940e,comment,11691306632,手机很好用,"2018-07-10 20:00:30",1,5,1,0,56,,j***3,铜牌会员,4,来自京东Android客户端,1,24,"2018-06-16 16:28:00",0,NO_MESSAGE
7479912,40de71b7-640b-4c7f-bdc7-b154a2480d0b,comment,11663085455,"一直在关注play，看了很多评论，对比了其他最新发布的手机，我选择了play。
①首赞，备货很充足，不耍。晚上下单，订单提醒后天才到，居然第二天就到了。
②再赞，收到手机首先就是下载鲁大师，跑分接近20万，跑完后温度达到47&deg;，还有高，担心游戏运行时会更高，随后玩王者和CF一个小时，温度都不高41&deg;的样子，游戏顺畅，GPU Turbo加持效果不错。
③还赞，性价比高，配置给力，麒麟970处理器，电池容量3750也比较大，待机时间长，一个晚上待机消耗3%左右，上班可以用1天半，主流刘海平，手感轻薄舒适，拍照清晰，外观漂亮；
④复赞，还未找到缺点；
⑤支持970，支持华为，支持国产。4年的P7用户，3月买的畅玩7X，到现在的play。","2018-07-02 10:07:24",0,5,10,0,105,,V***n,PLUS会员,4,来自京东Android客户端,1,12,"2018-06-20 19:12:40",0,NO_MESSAGE
20349124505,45a986b3-4991-4511-83f8-10ce26459824,comment,10934523244,比官网贵，奈何官网抢不到,"2017-11-07 09:45:37",0,5,0,0,105,,q***2,PLUS会员,2,来自京东iPhone客户端,1,10,"2017-10-28 23:24:58",0,NO_MESSAGE
30153140071,bc192861-311a-406b-bdca-e427882a345e,comment,11782320106,此用户未填写评价内容,"2018-08-07 13:14:14",1,5,0,0,105,,j***p,PLUS会员,4,来自京东Android客户端,1,2,"2018-08-05 00:24:22",0,NO_MESSAGE
