sku_id,_id,item_name,comment_id,content,creation_time,reply_count,score,useful_vote_count,useless_vote_count,user_level_id,user_province,nickname,user_level_name,user_client,user_client_show,is_mobile,days,reference_time,after_days,after_user_comment
7321794,6b245ee6-6ae3-459d-a1cc-e994912c9047,comment,11486084463,"拿到手后用了两天，点评如下：
1.外形靓丽，极光色后盖耀眼程度不言而喻
2.系统流畅度还行，整机比用来拍摄的iPhone7稍厚，手感与之相比稍欠佳
3.全面屏显示效果也还比较细腻，，指纹识别灵敏，人面识别在暗光下不太好，好几次失败后跳转为指纹或密码
4.快充充电实用
5.音质不错
6.莱卡双摄强大无比，像素、效果、自拍都出色，如果换成Pro应该更赞
7.全面屏操作习惯后也还好，下面有home键，开车时比较方便实用","2018-05-15 12:30:33",5,5,13,0,105,,烟***_,PLUS会员,2,来自京东iPhone客户端,1,5,"2018-05-10 11:27:37",0,NO_MESSAGE
7651927,52b8acec-3709-4e58-912e-2e6ae333dc25,comment,11808475715,帮同事买的，东西好。值得信赖。,"2018-08-15 12:59:52",0,5,0,0,61,,n***v,PLUS会员,2,来自京东iPhone客户端,1,8,"2018-08-07 18:45:39",0,NO_MESSAGE
5375693,5cd8e642-cdb1-496a-bf60-e42307e5ceb3,comment,11795590793,"用了大概十天还可以 给奶奶买的 老人家听起来挺好的","2018-08-11 13:52:25",0,5,0,0,61,,j***8,PLUS会员,2,来自京东iPhone客户端,1,13,"2018-07-29 10:16:05",0,NO_MESSAGE
7534113,a7548c0e-e191-491c-8109-c00c00707cf5,comment,11808625202,手指质量真好放心买吧,"2018-08-15 13:45:46",0,5,0,0,105,,H***m,钻石会员,2,来自京东iPhone客户端,1,1,"2018-08-14 13:42:47",0,NO_MESSAGE
7479912,cea4e76a-de27-498a-82a3-1b81d05287f2,comment,11612062302,快递快到无话可说17号下单18号收到订单，笔记本电脑百份百是全新的非常中意。,"2018-06-19 11:32:50",10,5,17,0,62,,何***記,金牌会员,2,来自京东iPhone客户端,1,1,"2018-06-18 15:12:29",0,NO_MESSAGE
5402840,cebf4767-dd7c-46e0-a9e4-e9d327109460,comment,11788227529,手机不错，适合值班～～,"2018-08-09 10:20:42",0,5,0,0,62,,C***9,PLUS会员,4,来自京东Android客户端,1,1,"2018-08-08 17:40:35",0,NO_MESSAGE
7437788,02f99a5a-aea2-46ad-93f3-a1f4378c7ecf,comment,11643972191,"经常网购，总有大量包裹收, 感觉写评语花掉了大量的时间和精力，所以在一段时间里， 我总是不去评价，或者是随便写，但是我又总觉得好像对不住那些辛勤工作的卖家，仓管，客服,老板，于是我写下这一小段话给我觉得能拿到五星好评卖家的宝贝评价， 以示感谢。首先宝贝性价比很高，我先试用再评价的。虽然宝贝不一定是最好的，但在价位里面绝对是表现最棒的，京东的配送绝对是一流的，送货速度快，服务态度好，每样东西都送货上门，希望京东能再接再厉，做得更大更强,提供更好更多的东西给大家，为京东的商品和服务点赞。","2018-06-26 15:10:33",4,5,15,0,105,,忠***子,PLUS会员,4,来自京东Android客户端,1,8,"2018-06-18 00:00:12",0,NO_MESSAGE
8484451,09f5859f-39ea-42ec-9323-83975a5032ce,comment,11788266064,以前用过酷派，质量很不错，就是外观比较中规中矩，这款产品酷派的外观设计还是跟得上潮流步伐的,"2018-08-09 10:29:42",0,5,1,0,61,,C***祥,银牌会员,2,来自京东iPhone客户端,1,2,"2018-08-07 10:51:38",0,NO_MESSAGE
7694047,d5ca623c-c574-4f66-a59c-043be1d445ef,comment,11699514916,刚拿到手，正品没开封，外观漂亮，电池行不行还不知道，齐刘海挺好看，不输苹果其他，支持国货。,"2018-07-13 11:51:35",0,5,8,0,105,,尘***恋,钻石会员,2,来自京东iPhone客户端,1,1,"2018-07-12 16:43:51",0,NO_MESSAGE
7846413,bf336661-05cb-453d-9ba4-f49f2bc52cff,comment,11596211262,晓龙845配合小米系统，非常流畅，照相也有大幅提升，续航也满意,"2018-06-15 16:32:55",3,5,1,0,105,,h***1,PLUS会员,0,,0,10,"2018-06-05 10:00:11",0,NO_MESSAGE
8239683,ab73f340-664e-4304-a9bc-2c1e4c63c263,comment,11717198697,"用了一段时间才评价，首先1.速度快，4+64G运行内存和存储内存空间都很充足；2.系统很纯净，除了应用市场，没有安装流氓软件，都是可以卸载的；3.有很多实用小工具，例如长截屏，对于喜欢在手机办公的我来说，发送个长截屏真的是分分钟的事情，超级简单；4.外观和手感不错，做工认真， 总的来说还是不错的，性价比很好，希望小辣椒手机在高性价比方面以后越做越好。","2018-07-18 16:13:59",0,5,0,0,61,,浮***丶,银牌会员,2,来自京东iPhone客户端,1,29,"2018-06-19 15:53:41",0,NO_MESSAGE
5853593,f2f666f3-a97a-4381-9b11-c96c185b6120,comment,11122370162,外观还可以，也不是很厚，金属机身，重量略重，18:9的所谓全面屏确实很显大，正面指纹点个大赞，安卓8.0的最新系统，这个华为确实走在了业界前端啊！整体做工显示了华为的大厂风范！970的加持也使机器位列中高端产品，2699的性价比基本可以甩oppo，vivo一条街了！推荐购买！,"2018-01-01 14:05:14",38,5,50,0,105,,M***O,PLUS会员,4,来自京东Android客户端,1,4,"2017-12-28 11:52:46",0,NO_MESSAGE
6610412,ad4586b7-0bc9-4f12-b40d-f31e9ac9f2b8,comment,11461011428,微信视频都能把手机卡坏，手机不能重启，不能关机，任何操作都不能，不能充电，就是屏幕一直亮着，我应该怎么办？以后应该怎么用？夏普的售后行不行？手机购卖时间不到2月。,"2018-05-06 22:18:26",21,1,25,0,62,,j***4,金牌会员,2,来自京东iPhone客户端,1,37,"2018-03-30 18:47:38",0,NO_MESSAGE
5019352,7279e3e3-c77a-42c6-a2cb-35f20655b7a5,comment,11799838332,非常好的一部手机，性价比很高，非常喜欢，支持国产！,"2018-08-12 19:40:53",0,5,0,0,105,,m***f,PLUS会员,2,来自京东iPhone客户端,1,50,"2018-06-23 15:37:01",0,NO_MESSAGE
5375693,5cd8e642-cdb1-496a-bf60-e42307e5ceb3,comment,11807033587,是正品，质量不错，推荐购买！送货很快，信赖京东！,"2018-08-14 22:54:15",0,5,0,0,105,,t***g,PLUS会员,4,来自京东Android客户端,1,12,"2018-08-02 19:39:57",0,NO_MESSAGE
7534113,a7548c0e-e191-491c-8109-c00c00707cf5,comment,11790865849,都还可以，就是电信卡为什么老是网络连接失败？还有就是耳机插上耳机有声音，外放还有声音，而且手机还不显示耳机以插入，等有时间去售后去看看,"2018-08-10 00:37:48",1,5,0,0,56,,七***人,铜牌会员,4,来自京东Android客户端,1,2,"2018-08-08 01:38:23",0,NO_MESSAGE
7479912,cea4e76a-de27-498a-82a3-1b81d05287f2,comment,11692866777,外观看着很舒服，不挑剔，充电口改为类似乐视的圆口插口而不是以前的安卓通用型，快递超快，晚上下单，第二天白天就到了！还送了一个手机软壳，也没有像网友说的那些毛病，包装盒子很硬，完全可以保护手机，手机也是正品，无拆封无异常！是我的正妻?一会测一下小兔子再来追评！,"2018-07-11 11:07:56",1,5,9,0,62,,h***_,金牌会员,4,来自京东Android客户端,1,1,"2018-07-10 19:01:41",1,安兔兔跑分20万+心情美美哒
5942439,49c599ba-2761-4200-8fcb-2af434620502,comment,11807079233,用了才评价，电池非常耐用，十天半个月都不用充电,"2018-08-14 23:14:30",0,5,0,0,105,,m***8,钻石会员,4,来自京东Android客户端,1,44,"2018-07-01 09:26:11",0,NO_MESSAGE
5663902,96c380e7-f8e3-4e18-bf4d-8b5275ec3bd9,comment,11136498136,很漂亮，买来做备用机的，不打游戏。一直苹果7年，几乎不太会用安卓了，有点不习惯，但是真的指纹解锁秒解，比我7P还快，让我有点惊讶，流畅度也不错。应用分身太棒了，对于WX一个工作号一个私人号的我来说真的不错，不用再买软件。以后有考虑用华为了，买个好点的。因为双卡双待和微信分身就方便很多不用再带两个手机那么麻烦了。千元机中无论外形还是功能都够用了，反正不打游戏。,"2018-01-06 18:17:33",8,5,15,0,105,,超***奇,钻石会员,2,来自京东iPhone客户端,1,2,"2018-01-04 22:08:25",0,NO_MESSAGE
5402840,cebf4767-dd7c-46e0-a9e4-e9d327109460,comment,11760615000,给老爷子买的，希望他能喜欢！,"2018-07-31 18:28:02",0,5,0,0,105,,t***6,钻石会员,4,来自京东Android客户端,1,0,"2018-07-31 06:03:58",0,NO_MESSAGE
7437788,02f99a5a-aea2-46ad-93f3-a1f4378c7ecf,comment,11611551387,很满意，运行速度很快，发货也比较快，能在这个时候拿到上个月月底刚发布的新手机，也算是不错了。全面屏还是很震撼的，虽然有大大的刘海，但是并没有想象中那么丑，刚发布时看网上的视频和图片，感觉丑炸天，打死也不买它，后来去小米之家试玩了真机，感觉还挺好看的，和我一起去体验的朋友也是同样的看法。做工算可以，按键确实有松动，网上说的疏油层问题似乎也存在，但感觉没啥影响，网友们担心的屏幕辣眼睛问题实际体验是确实辣眼睛，但也在可接受范围。许多问题其实别人不说我们可能根本不会在意，只是大家都在讲，强化了我们对于某个方面的恶感。总之，这个价格买到这个配置足矣，这所谓求仁得仁，在意价格和配置的，买米8没错。京东这次的包装真的不行，直接放在一个小纸盒里，纸盒与手机原包装之间没有任何防护措施，拿到快递摇一摇，胆战心惊。还好开箱没啥问题，希望京东可以改进一下。附上几张开箱照和实拍样张。,"2018-06-19 10:11:10",10,5,4,0,105,,了***男,钻石会员,4,来自京东Android客户端,1,3,"2018-06-16 10:00:06",0,NO_MESSAGE
8484451,09f5859f-39ea-42ec-9323-83975a5032ce,comment,11771822639,昨天收到的，外观真的无可挑剔，迫不及待用了一下，很不错，后续使用再追加评论,"2018-08-04 09:42:46",0,5,2,0,56,,j***5,铜牌会员,21,来自微信购物,0,2,"2018-08-02 11:06:02",0,NO_MESSAGE
7694047,d5ca623c-c574-4f66-a59c-043be1d445ef,comment,11593467044,"公司给我配的手机，要我自己选，不好意思选贵的，就选择了这款，说实话，很惊艳！手感还有外观都很惊艳，而且我自己是5.99的全面屏，用了这个以后觉得还是小屏幕适合我！哈哈哈? 推荐！送给女朋友也很好哦！拿在手里有种小巧的感觉！快递是真的快哟！晚上九十点下的单，第二天一大早就到咯！","2018-06-14 21:16:47",13,5,8,0,61,,小***粒,银牌会员,4,来自京东Android客户端,1,2,"2018-06-12 20:06:45",0,NO_MESSAGE
7846413,bf336661-05cb-453d-9ba4-f49f2bc52cff,comment,11713536959,"给老婆买的 她再也不用担心看直播会卡啦 资深米粉 黏着度非常高 买的x21 她不满意 还是最喜欢米8啊 加载超快 加油小米 加油京东！","2018-07-17 15:04:23",0,5,4,0,105,,c***3,PLUS会员,4,来自京东Android客户端,1,4,"2018-07-13 10:00:33",0,NO_MESSAGE
8239683,ab73f340-664e-4304-a9bc-2c1e4c63c263,comment,11769044334,产品不错，京东快递也很快,"2018-08-03 11:23:17",0,5,1,0,62,,water9518,金牌会员,2,来自京东iPhone客户端,1,4,"2018-07-30 11:24:02",0,NO_MESSAGE
5853593,f2f666f3-a97a-4381-9b11-c96c185b6120,comment,11610180141,"宝贝收到了，包装很好，颜色很喜欢，送了白色手机壳。用了一个多星期，是正品，一直用着荣耀手机，从荣耀6，荣耀8到现在的荣耀v10,使用起来特别流畅，吃鸡也是，手机手感很棒，运行速度快，照相效果好，音质也不错，性价比高，祝华为荣耀手机越做越好，给五星！","2018-06-18 22:46:19",0,5,1,0,61,,j***f,银牌会员,4,来自京东Android客户端,1,7,"2018-06-11 23:09:46",0,NO_MESSAGE
6610412,ad4586b7-0bc9-4f12-b40d-f31e9ac9f2b8,comment,11785247336,非常好，华丽了不少，但感觉后面摄像头不如s2,"2018-08-08 11:34:54",0,5,1,0,62,,j***f,PLUS会员,4,来自京东Android客户端,1,52,"2018-06-17 22:01:49",0,NO_MESSAGE
5019352,7279e3e3-c77a-42c6-a2cb-35f20655b7a5,comment,11783737248,外观挺好看的，电池容量大，老爸挺喜欢,"2018-08-07 20:52:18",0,5,0,0,105,,z***8,PLUS会员,2,来自京东iPhone客户端,1,0,"2018-08-07 09:41:15",0,NO_MESSAGE
8344046,80d566df-20b7-41f3-be9a-5c4b516a7eec,comment,11786457566,"手机外观设计很时尚，侧面看起来比产品图片更薄，整个手机触感起来很舒适，这配置对于不是经常玩手游的我其实很足够，微信多开采用新一代AI红外人像解锁，白天、晚上均能精准捕捉识别桌面抽屉这些功能对于上班族来说很实用,支持京东，支持小辣椒！","2018-08-08 17:49:13",3,5,2,0,61,,浮***丶,银牌会员,2,来自京东iPhone客户端,1,1,"2018-08-07 10:51:11",2,用了下黑科技，很给力，32个赞?
8240587,a3a4933f-f681-46be-9ed3-d670a56f65cc,comment,11793901675,纠结了很久还是买了nova3果然没让我失望，超喜欢，第一次用华为，支持,"2018-08-10 22:13:52",0,5,0,0,61,,j***0,银牌会员,4,来自京东Android客户端,1,0,"2018-08-10 08:57:08",0,NO_MESSAGE
5001213,c2df3c2c-79ec-47df-9890-0445e572b95d,comment,11254137532,"试用了半天感觉电池不太耐用，应该要刷国际版才可以省电，我的红米note3刷了就很省
机器比较重手感很好，但是光线传感器在屏幕下面，不知道是贴膜挡住了还是就这样，亮度调节不是很灵敏，进测试菜单也没有反应
超声波距离传感器蛮好玩的，贴了膜也能用
S835+UFS装软件就是快，一个app只要几秒钟就能装好，红米要半分钟到一分钟才行
拍照也不错，反应很快","2018-02-22 00:12:14",12,5,28,0,62,,e***3,金牌会员,4,来自京东Android客户端,1,3,"2018-02-19 18:47:44",0,NO_MESSAGE
5089275,28f451c5-6bd7-4169-9edb-ff6862f8f15b,comment,11211053082,终于收到我需要的宝贝了，东西很好，价美物廉。说实在，这是我京东购物来让我最满意的一次购物，比~的购物体验好多了。无论是卖家的态度还是对物品，我都非常满意的。再说宝贝，正是我需要的，收到的时候包装完整，打开后让我惊喜的是，宝贝比我想象中的还要好！不得不得竖起大拇指。下次需要的时候我还会再来的。发货速度更是不用说，隔天就可以收到宝贝，超级赞。,"2018-02-01 23:25:46",24,5,29,0,105,,张***5,PLUS会员,4,来自京东Android客户端,1,2,"2018-01-30 23:59:07",0,NO_MESSAGE
5089267,74021424-1127-4aa3-a7c7-669c6f43bbff,comment,11618546752,说一下买这个手机的各种荡气回肠吧！首先我是第一次用苹果，之前的安卓是某驰名音乐手机，用了不到两年，接打电话功能不能用了，等于主板坏了，摆设了！同学差不多同一时间买的苹果，还用的好好的！从5.18开始的4499元到6.18各种价格忽高忽低，但是也就介于100-200之间，我没想过买红色，6.18当晚看到秒杀价格4399元，等交完款，发现8的各种颜色都是4399元，不然还得换来换去，不就是个颜色嘛，带个手机壳啥也看不出来，说实话京东的包装有点简陋，里边苹果自己的包装也有稍微破损，毕竟是电子产品，包装不要求多豪华但至少看着结实保证物品安全，第一次用苹果嘛，尤其是home是返回键，还得使劲按。等一个月是同事同学都说，会便宜个300-400元，那等吧，结果，作为没怎么在京东购物过的我，傻眼了，各种券抢都有限制，比如京享值5000还有10000的才能抢，比如必须是plus会员才能抢，寻思着白等了一个来月，不过6.18的0点还是给了点力，比之前便宜100块钱呢，自我安慰喽！不过话说苹果真的好用么，可能是我刚开始接触这种系统，真心用不惯，同学说，你这是刚开始，以后你会爱上或者依赖苹果系统的！我，哈哈！,"2018-06-20 14:32:58",12,5,9,0,61,,小***肥,银牌会员,4,来自京东Android客户端,1,2,"2018-06-18 00:00:08",0,NO_MESSAGE
7534113,a7548c0e-e191-491c-8109-c00c00707cf5,comment,11756929365,刚到手，用着还可以，备用机可以了，五星好评，主要是快递员太辛苦了，大热天的&hellip;&hellip;,"2018-07-30 16:36:30",4,5,0,0,62,,a***2,金牌会员,2,来自京东iPhone客户端,1,1,"2018-07-29 16:07:14",1,我就想问下，我30号买的，为啥11号就有音乐文件？还是下载的？备份显示的时间是20号百度显示的时间是1号！求解释！这就是所谓的京东吗？
7479912,cea4e76a-de27-498a-82a3-1b81d05287f2,comment,11581267990,"早上11点下单，下午17点收到，京东快递神速，快递小哥今天来了两次，感谢京东快递！
手机使用顺畅，拍照效果非常好，前置摄像头像素：1600万-1999万，后置摄像头像素：1200万-1999万，音质也特别棒，手机握在手里感觉感觉非常舒服，贴心，6.3英寸的屏幕比mate10稍窄了一点，长了一点。总之还没有发现任何瑕疵。
期待华为&ldquo;吓人的技术&rdquo;真不是盖的!","2018-06-11 19:12:57",13,5,48,0,105,,j***3,钻石会员,4,来自京东Android客户端,1,0,"2018-06-11 11:00:20",3,使用几天了，感觉不错，电池续航能力可以，手机玩的时候也不怎么发热，三手指下拉可以截屏，相机?中很多趣味功能使用起来感觉非常棒！说句真心话，两千块钱的手机加上华为吓人的技术你没有感觉超值吗？
5942439,49c599ba-2761-4200-8fcb-2af434620502,comment,11790122180,质量好，音质清晰，信号很棒,"2018-08-09 19:46:26",0,5,0,0,61,,z***5,PLUS会员,4,来自京东Android客户端,1,1,"2018-08-08 19:50:23",0,NO_MESSAGE
5663902,96c380e7-f8e3-4e18-bf4d-8b5275ec3bd9,comment,11120615473,很漂亮，上个月买没有买到，买了个荣耀8，现在老弟要买手机，就入手了这款，确实漂亮，质量咋样还没有用，不评价，荣耀八不错,"2017-12-31 17:48:14",5,5,10,0,61,,逍***x,银牌会员,4,来自京东Android客户端,1,2,"2017-12-29 18:43:05",0,NO_MESSAGE
5402840,cebf4767-dd7c-46e0-a9e4-e9d327109460,comment,11801530060,快递小哥辛苦了,"2018-08-13 11:23:35",0,5,0,0,62,,j***t,金牌会员,4,来自京东Android客户端,1,1,"2018-08-12 11:59:43",0,NO_MESSAGE
7437788,02f99a5a-aea2-46ad-93f3-a1f4378c7ecf,comment,11558239041,还没拆，想等探索版。。。。。。。纠结。。。。！！？,"2018-06-05 18:46:46",47,5,104,0,105,,在***名,PLUS会员,4,来自京东Android客户端,1,4,"2018-06-01 00:17:38",5,还没拆，2699出，要的给联系方式
8484451,09f5859f-39ea-42ec-9323-83975a5032ce,comment,11769648587,一如既往相信京东，手机外观很满意很时尚，给家人买的，很喜欢,"2018-08-03 14:30:40",0,5,3,0,56,,j***s,铜牌会员,4,来自京东Android客户端,1,1,"2018-08-02 11:28:31",0,NO_MESSAGE
7694047,d5ca623c-c574-4f66-a59c-043be1d445ef,comment,11789557260,好好好，物流快性价比高，手机很好用，嘻嘻，下次还来买，老顾客了，很好用，用着很放心，电池也很耐用，好好好,"2018-08-09 16:42:05",0,5,0,0,61,,1***哥,PLUS会员[试用],4,来自京东Android客户端,1,16,"2018-07-24 18:26:19",0,NO_MESSAGE
7846413,bf336661-05cb-453d-9ba4-f49f2bc52cff,comment,11593895812,不错，还没拆封呢，都说抢不到，新鲜怎么一抢就到手了呢！,"2018-06-14 23:31:52",0,5,0,0,61,,落***5,银牌会员,2,来自京东iPhone客户端,1,9,"2018-06-05 10:00:43",0,NO_MESSAGE
8239683,ab73f340-664e-4304-a9bc-2c1e4c63c263,comment,11717186715,给五星好评！首先，客服服务好、手机不错、款式漂亮，全面屏，一看就喜欢，手感特别好。开机后给我的感觉特别好，画面清晰细腻，色彩饱和度很高！冲着这个899元价格，实在优惠、而且性能强劲，人脸解锁和指纹解锁速度很快，尝试了一下人脸识别，感觉解锁速度也足够快，软件都可以卸载，没有多余的插件和应用，4+64G绝对够用！,"2018-07-18 16:10:17",0,5,0,0,61,,路***天,银牌会员,4,来自京东Android客户端,1,29,"2018-06-19 16:18:39",0,NO_MESSAGE
5853593,f2f666f3-a97a-4381-9b11-c96c185b6120,comment,11218027765,心仪已久，终于抢到了，使用体验很好，是我想要的(???)?表白我大荣耀?(?ˊ??ˋ)?666?红色版本漂亮的不像话，拍照体验极佳?&bull;??&bull;??等过几天在帮老公买一个蓝色的(???)?指纹超级灵敏了，大爱,"2018-02-04 10:16:33",7,5,11,0,105,,J***儿,钻石会员,2,来自京东iPhone客户端,1,15,"2018-01-20 00:59:27",0,NO_MESSAGE
5019352,7279e3e3-c77a-42c6-a2cb-35f20655b7a5,comment,11784147417,系统精简，挺好。内存大，挺好。玩游戏农药没问题，挺好。电量耗得挺快，一局游戏百分之6左右，不像公布的那么大电池容量，不好。拍照不关注，够用。声音还没试。网络信号，有些弱，不好。装了QQ浏览器，桌面没有图标，重启手机后才重新出现，不知是否是系统bug。总体，这个价位还是满意的。,"2018-08-07 23:15:19",0,5,0,0,61,,j***y,银牌会员,29,,0,1,"2018-08-06 16:14:36",0,NO_MESSAGE
8344046,80d566df-20b7-41f3-be9a-5c4b516a7eec,comment,11780645252,"这是买的第3个小辣椒手机了。公司诚信经营是不会错的，特别是在竞争大的情况下。
这款新出的小辣椒到手了，大致使用了一下，没有发现与介绍不符的情况，比如人脸解锁，指纹解锁等都非常好用，当然还有些功能比如无线充电等没有去试，但是相信小辣椒公司，一定不会欺骗的。
上次买的4a运存内存都够用，但是cpu没上档次。这次买的r15，cpu已经是高端的了，内存就更不用说了，另外还有很多尖端的科技。这样的配置华为肯定要上5000，并且质量未必有小辣椒好。用不到2000的价格买个高端手机，真的值了。
为什么说小辣椒质量比华为好，这是我用过两个小辣椒手机和两个华为手机总结出来体会。小辣椒唯一要改善的是内装的系统，要纯净一点，否则再好的机子也难有好的表现。好在r15已经改善了，系统也很给力。继续加油吧，看好你，小辣椒","2018-08-06 21:54:55",1,5,1,0,61,,z***n,银牌会员,0,,0,1,"2018-08-05 19:05:03",5,用了几天，感觉很好。印象比较深刻的有3点：一是运行很流畅，毕竟里面是高端cpu了；二是红外人脸解锁很给力，都是秒开，有天晚上在黑暗的环境下看到摄像头闪红光，吓着我了，原来是在红外人脸解锁；三是系统里面有个系统管家很好，后台程序都可以管住，除非把它加入白名单。其他的照相什么的也照了几张，感觉反应很快，效果也好。不过不懂照相，也不好怎么深入评论了。
8240587,a3a4933f-f681-46be-9ed3-d670a56f65cc,comment,11759575161,我不知道为什么一听歌和玩游戏手机就发热还有接缝出有点刮手,"2018-07-31 13:11:49",0,5,1,0,61,,j***c,银牌会员,4,来自京东Android客户端,1,1,"2018-07-30 22:57:34",0,NO_MESSAGE
5001213,c2df3c2c-79ec-47df-9890-0445e572b95d,comment,11110551477,"实物非常惊艳，这是我第一购买小米，朋友是个米粉，我问他MATE10和MIX2选哪个，他毫不犹豫的推荐MIX2，说他手上现在用的是MIX一代，除了听筒漏音，摄像头弱了点，很完美。  并且推荐二代是因为已经改善了这些问题。 本来准备买标准版256G的，他提醒说高配版配置高让我一步到位，本来很犹豫内存大小的，为了解决纠结，把之前买的7plus 128G的拒收直接换了8plus 256G的。
   上个月买的华为P10在生气的时候连同服役很久了的6S报废了，可以很明确的说同时手握三台手机的我（还有台iPhoneSE 64G），发现P10打开软件过程中会有点卡，但是这次手持8PLUS和MIX2，虽然8P比之前体验的7Plus要更快，但是MIX2也没感觉逊色多少，也许是8G运行内存的原因。
    总结：购买8G内存版有两个收获，1.非常流畅，所以使用率高起来了，不像之前的P10，滑动界面快，但是打开软件总是在转圈，最后我只用来打接电话了。
           2.买了几个保护套，才偶然知道8G全陶瓷的边框要窄过标准版，难怪我没觉得别人评价说边框很厚的，这是意外收获。
      非常推荐购买！","2017-12-27 20:36:05",0,5,18,0,105,,北***分,PLUS会员,2,来自京东iPhone客户端,1,13,"2017-12-14 18:02:15",0,NO_MESSAGE
5089275,28f451c5-6bd7-4169-9edb-ff6862f8f15b,comment,10963610277,"东西已经收到，京东快递送货一流，服务态度也很好，手
机用起来很快，做工问题还是可以，音质各方面都还可以！第一次在网上买苹果手机，希望售后能跟上！","2017-11-13 14:30:34",31,5,82,0,105,,c***1,钻石会员,4,来自京东Android客户端,1,2,"2017-11-11 16:45:09",0,NO_MESSAGE
7081550,30614cf4-1a96-4436-8c9e-c81272828842,comment,11509068607,电池续航能力不错，拍照也清晰，使用流畅，不过感觉用起来屏幕上的字体大小有点怪怪的，怪不舒服的赶脚。自带的手机屏幕上的膜很一般，太容易留手指印了。此外，这手机的一个缺点是屏幕黑着的时候，手机正面上下看起来一样，很容易搞不清。,"2018-05-22 15:54:03",4,5,25,0,61,,b***z,银牌会员,4,来自京东Android客户端,1,8,"2018-05-14 07:59:32",0,NO_MESSAGE
